{
  "$schema": "https://json-schema.org/draft/2020-12/schema",

  "type": "object",
  "properties": {
    "name": { "type": "string" },
    "wait_timer": { "type": "integer" },
    "reviewers": {
      "type": "array",
      "items": { "type": "string" }
    },
    "prevent_self_review": { "type": "boolean" },
    "deployment_branch_policy": { "type": "string", "enum": ["all", "protected", "selected"] },
    "branch_policies": {
      "type": "array",
      "items": { "type": "string" }
    },
    "secrets": {
      "type": "array",
      "items": { "$ref": "environment-secret.json" }
    },
    "variables": {
      "type": "array",
      "items": { "$ref": "environment-variable.json" }
    }
  },

  "required": [ "name" ],
  "additionalProperties": false
}
