{
  "name": "linux",
  "wait_timer": 15,
  "reviewers": [
    "@netomi",
    "@OtterdogTest/eclipsefdn-security"
  ],
  "prevent_self_review": true,
  "deployment_branch_policy": "selected",
  "branch_policies": [
    "main",
    "develop/*"
  ],
  "secrets": [
    {
      "name": "ENV-SECRET",
      "value": "1234"
    }
  ],
  "variables": [
    {
      "name": "ENV-VARIABLE",
      "value": "some-value"
    }
  ]
}
